<?xml version="1.0" encoding="UTF-8"?>
<d1:log xmlns:common="http://dataone.org/service/types/common/0.1"
 xmlns:d1="http://dataone.org/service/types/logging/0.1"
 xmlns:xsi="http://www.w3.org/2001/XMLSchema-instance"
 xsi:schemaLocation="http://dataone.org/service/types/logging/0.1 https://repository.dataone.org/software/cicore/trunk/schemas/logging.xsd">
    <logEntry>
        <entryId>123</entryId>
        <identifier>ABC</identifier>
        <ipAddress>1.2.3.4</ipAddress>
        <userAgent>userAgent0</userAgent>
        <principal>me</principal>
        <event>create</event>
        <dateLogged>2006-05-04T18:13:51.0Z</dateLogged>
        <memberNode>mn1</memberNode>
    </logEntry>
    <logEntry>
        <entryId>456</entryId>
        <identifier>DEF</identifier>
        <ipAddress>0.1.0.2</ipAddress>
        <userAgent>userAgent1</userAgent>
        <principal>you</principal>
        <event>create</event>
        <dateLogged>2006-05-04T18:13:51.0Z</dateLogged>
        <memberNode>mn1</memberNode>
    </logEntry>
    <logEntry>
        <entryId>789</entryId>
        <identifier>GHI</identifier>
        <ipAddress>5.4.3.2</ipAddress>
        <userAgent>userAgent2</userAgent>
        <principal>it</principal>
        <event>create</event>
        <dateLogged>2006-05-04T18:13:51.0Z</dateLogged>
        <memberNode>mn1</memberNode>
    </logEntry>
</d1:log>
